00:00.0 Host bridge: ATI Technologies Inc RS200/RS200M AGP Bridge [IGP 340M] (rev 02)
	Control: I/O- Mem+ BusMaster+ SpecCycle- MemWINV- VGASnoop- ParErr- Stepping- SERR- FastB2B- DisINTx-
	Status: Cap+ 66MHz+ UDF- FastB2B- ParErr- DEVSEL=medium >TAbort- <TAbort- <MAbort- >SERR- <PERR- INTx-
	Latency: 64
	Region 0: Memory at 9c000000 (32-bit, prefetchable) [size=64M]
	Region 1: Memory at 98500000 (32-bit, prefetchable) [size=4K]
	Capabilities: [a0] AGP version 2.0
		Status: RQ=16 Iso- ArqSz=0 Cal=0 SBA+ ITACoh- GART64- HTrans- 64bit- FW+ AGP3- Rate=x1,x2,x4
		Command: RQ=1 ArqSz=0 Cal=0 SBA+ AGP+ GART64- 64bit- FW- Rate=x4
	Kernel driver in use: agpgart-ati
	Kernel modules: ati-agp

00:01.0 PCI bridge: ATI Technologies Inc PCI Bridge [IGP 340M]
	Control: I/O+ Mem+ BusMaster+ SpecCycle- MemWINV- VGASnoop- ParErr- Stepping- SERR- FastB2B- DisINTx-
	Status: Cap- 66MHz+ UDF- FastB2B- ParErr- DEVSEL=medium >TAbort- <TAbort- <MAbort- >SERR- <PERR- INTx-
	Latency: 99
	Bus: primary=00, secondary=01, subordinate=01, sec-latency=66
	I/O behind bridge: 00002000-00002fff
	Memory behind bridge: 90000000-900fffff
	Prefetchable memory behind bridge: 94000000-97ffffff
	Secondary status: 66MHz+ FastB2B- ParErr- DEVSEL=medium >TAbort- <TAbort- <MAbort+ <SERR- <PERR-
	BridgeCtl: Parity- SERR- NoISA+ VGA+ MAbort- >Reset- FastB2B-
		PriDiscTmr- SecDiscTmr- DiscTmrStat- DiscTmrSERREn-
	Kernel modules: shpchp

00:06.0 Multimedia audio controller: ALi Corporation M5451 PCI AC-Link Controller Audio Device (rev 02)
	Subsystem: Compaq Computer Corporation Device 005a
	Control: I/O+ Mem+ BusMaster+ SpecCycle- MemWINV- VGASnoop- ParErr- Stepping- SERR- FastB2B- DisINTx-
	Status: Cap+ 66MHz- UDF- FastB2B+ ParErr- DEVSEL=medium >TAbort- <TAbort- <MAbort- >SERR+ <PERR+ INTx-
	Latency: 64 (500ns min, 6000ns max)
	Interrupt: pin A routed to IRQ 11
	Region 0: I/O ports at 3000 [size=256]
	Region 1: Memory at 98100000 (32-bit, non-prefetchable) [size=4K]
	Capabilities: [dc] Power Management version 2
		Flags: PMEClk- DSI+ D1+ D2+ AuxCurrent=0mA PME(D0-,D1-,D2+,D3hot+,D3cold+)
		Status: D0 PME-Enable- DSel=0 DScale=0 PME-
	Kernel driver in use: ALI 5451
	Kernel modules: snd-ali5451, trident

00:07.0 ISA bridge: ALi Corporation M1533/M1535 PCI to ISA Bridge [Aladdin IV/V/V+]
	Subsystem: Compaq Computer Corporation Device 005a
	Control: I/O+ Mem+ BusMaster+ SpecCycle+ MemWINV- VGASnoop- ParErr- Stepping- SERR- FastB2B- DisINTx-
	Status: Cap+ 66MHz- UDF- FastB2B- ParErr- DEVSEL=medium >TAbort- <TAbort- <MAbort- >SERR- <PERR- INTx-
	Latency: 0
	Capabilities: [a0] Power Management version 1
		Flags: PMEClk- DSI- D1- D2- AuxCurrent=0mA PME(D0-,D1-,D2-,D3hot-,D3cold-)
		Status: D0 PME-Enable- DSel=0 DScale=0 PME-
	Kernel modules: alim1535_wdt, alim7101_wdt

00:08.0 Modem: ALi Corporation M5457 AC'97 Modem Controller
	Subsystem: Compaq Computer Corporation Device 005a
	Control: I/O+ Mem+ BusMaster- SpecCycle- MemWINV- VGASnoop- ParErr- Stepping- SERR- FastB2B- DisINTx-
	Status: Cap+ 66MHz- UDF- FastB2B+ ParErr- DEVSEL=medium >TAbort- <TAbort- <MAbort- >SERR- <PERR- INTx-
	Interrupt: pin A routed to IRQ 11
	Region 0: Memory at 98180000 (32-bit, non-prefetchable) [size=4K]
	Region 1: I/O ports at 3400 [size=256]
	Capabilities: [40] Power Management version 2
		Flags: PMEClk- DSI+ D1- D2- AuxCurrent=0mA PME(D0-,D1-,D2-,D3hot+,D3cold+)
		Status: D0 PME-Enable- DSel=0 DScale=0 PME-

00:09.0 Ethernet controller: Atheros Communications Inc. AR5212/AR5213 Multiprotocol MAC/baseband processor (rev 01)
	Subsystem: Compaq Computer Corporation Device 00e5
	Control: I/O- Mem+ BusMaster+ SpecCycle- MemWINV- VGASnoop- ParErr- Stepping- SERR- FastB2B- DisINTx-
	Status: Cap+ 66MHz- UDF- FastB2B+ ParErr- DEVSEL=medium >TAbort- <TAbort- <MAbort- >SERR- <PERR- INTx-
	Latency: 168 (2500ns min, 7000ns max), Cache Line Size: 64 bytes
	Interrupt: pin A routed to IRQ 5
	Region 0: Memory at 98080000 (32-bit, non-prefetchable) [size=64K]
	Capabilities: [44] Power Management version 2
		Flags: PMEClk- DSI- D1- D2- AuxCurrent=0mA PME(D0-,D1-,D2-,D3hot-,D3cold-)
		Status: D0 PME-Enable- DSel=0 DScale=2 PME-
	Kernel driver in use: ath5k_pci
	Kernel modules: ath5k

00:0b.0 CardBus bridge: O2 Micro, Inc. OZ711M1/MC1 4-in-1 MemoryCardBus Controller (rev 20)
	Subsystem: Compaq Computer Corporation Device 005a
	Control: I/O+ Mem+ BusMaster+ SpecCycle- MemWINV- VGASnoop- ParErr- Stepping+ SERR- FastB2B- DisINTx-
	Status: Cap+ 66MHz- UDF- FastB2B- ParErr- DEVSEL=slow >TAbort- <TAbort- <MAbort- >SERR- <PERR- INTx-
	Latency: 168
	Interrupt: pin A routed to IRQ 11
	Region 0: Memory at 98200000 (32-bit, non-prefetchable) [size=4K]
	Bus: primary=00, secondary=02, subordinate=05, sec-latency=176
	Memory window 0: 20000000-23fff000 (prefetchable)
	Memory window 1: 24000000-27fff000
	I/O window 0: 00001400-000014ff
	I/O window 1: 00001800-000018ff
	BridgeCtl: Parity- SERR- ISA- VGA- MAbort- >Reset- 16bInt+ PostWrite+
	16-bit legacy interface ports at 0001
	Kernel driver in use: yenta_cardbus
	Kernel modules: yenta_socket

00:0b.1 CardBus bridge: O2 Micro, Inc. OZ711M1/MC1 4-in-1 MemoryCardBus Controller (rev 20)
	Subsystem: Compaq Computer Corporation Device 005a
	Control: I/O+ Mem+ BusMaster+ SpecCycle- MemWINV- VGASnoop- ParErr- Stepping+ SERR- FastB2B- DisINTx-
	Status: Cap+ 66MHz- UDF- FastB2B- ParErr- DEVSEL=slow >TAbort- <TAbort- <MAbort- >SERR- <PERR- INTx-
	Latency: 168
	Interrupt: pin A routed to IRQ 11
	Region 0: Memory at 98280000 (32-bit, non-prefetchable) [size=4K]
	Bus: primary=00, secondary=06, subordinate=09, sec-latency=176
	Memory window 0: 28000000-2bfff000 (prefetchable)
	Memory window 1: 2c000000-2ffff000
	I/O window 0: 00001c00-00001cff
	I/O window 1: 00003c00-00003cff
	BridgeCtl: Parity- SERR- ISA- VGA- MAbort- >Reset- 16bInt+ PostWrite+
	16-bit legacy interface ports at 0001
	Kernel driver in use: yenta_cardbus
	Kernel modules: yenta_socket

00:0b.2 System peripheral: O2 Micro, Inc. OZ711Mx 4-in-1 MemoryCardBus Accelerator
	Subsystem: Compaq Computer Corporation Device 005a
	Control: I/O+ Mem+ BusMaster- SpecCycle- MemWINV- VGASnoop- ParErr- Stepping- SERR- FastB2B- DisINTx-
	Status: Cap+ 66MHz- UDF- FastB2B- ParErr- DEVSEL=slow >TAbort- <TAbort- <MAbort- >SERR- <PERR- INTx-
	Interrupt: pin A routed to IRQ 11
	Region 0: Memory at 98300000 (32-bit, non-prefetchable) [size=4K]
	Capabilities: [a0] Power Management version 2
		Flags: PMEClk- DSI- D1+ D2+ AuxCurrent=0mA PME(D0+,D1+,D2+,D3hot+,D3cold+)
		Status: D0 PME-Enable- DSel=0 DScale=0 PME-

00:10.0 IDE interface: ALi Corporation M5229 IDE (rev c4) (prog-if ea)
	Subsystem: Compaq Computer Corporation Device 005a
	Control: I/O+ Mem- BusMaster+ SpecCycle- MemWINV- VGASnoop- ParErr- Stepping- SERR- FastB2B- DisINTx-
	Status: Cap+ 66MHz- UDF- FastB2B+ ParErr- DEVSEL=medium >TAbort- <TAbort- <MAbort- >SERR- <PERR- INTx-
	Latency: 64 (500ns min, 1000ns max)
	Interrupt: pin A routed to IRQ 10
	Region 0: [virtual] Memory at 000001f0 (32-bit, non-prefetchable) [disabled] [size=8]
	Region 1: [virtual] Memory at 000003f0 (type 3, non-prefetchable) [disabled] [size=1]
	Region 2: [virtual] Memory at 00000170 (32-bit, non-prefetchable) [disabled] [size=8]
	Region 3: [virtual] Memory at 00000370 (type 3, non-prefetchable) [disabled] [size=1]
	Region 4: I/O ports at 3800 [size=16]
	Capabilities: [60] Power Management version 2
		Flags: PMEClk- DSI- D1- D2- AuxCurrent=0mA PME(D0-,D1-,D2-,D3hot-,D3cold-)
		Status: D0 PME-Enable- DSel=0 DScale=0 PME-
	Kernel driver in use: ALI15x3_IDE
	Kernel modules: alim15x3

00:11.0 Bridge: ALi Corporation M7101 Power Management Controller [PMU]
	Subsystem: Compaq Computer Corporation Device 005a
	Control: I/O- Mem- BusMaster- SpecCycle- MemWINV- VGASnoop- ParErr- Stepping- SERR- FastB2B- DisINTx-
	Status: Cap- 66MHz- UDF- FastB2B- ParErr- DEVSEL=medium >TAbort- <TAbort- <MAbort- >SERR- <PERR- INTx-
	Kernel driver in use: ali1535_smbus
	Kernel modules: alim7101_wdt, i2c-ali15x3, i2c-ali1535

00:12.0 USB Controller: NEC Corporation USB (rev 43) (prog-if 10)
	Subsystem: Compaq Computer Corporation Device 005a
	Control: I/O- Mem+ BusMaster+ SpecCycle- MemWINV- VGASnoop- ParErr- Stepping- SERR- FastB2B- DisINTx-
	Status: Cap+ 66MHz- UDF- FastB2B- ParErr- DEVSEL=medium >TAbort- <TAbort- <MAbort- >SERR- <PERR- INTx-
	Latency: 64 (250ns min, 10500ns max), Cache Line Size: 64 bytes
	Interrupt: pin A routed to IRQ 10
	Region 0: Memory at 98380000 (32-bit, non-prefetchable) [size=4K]
	Capabilities: [40] Power Management version 2
		Flags: PMEClk- DSI- D1+ D2+ AuxCurrent=0mA PME(D0+,D1+,D2+,D3hot+,D3cold+)
		Status: D0 PME-Enable- DSel=0 DScale=0 PME+
	Kernel driver in use: ohci_hcd
	Kernel modules: ohci-hcd

00:12.1 USB Controller: NEC Corporation USB (rev 43) (prog-if 10)
	Subsystem: Compaq Computer Corporation Device 005a
	Control: I/O- Mem+ BusMaster+ SpecCycle- MemWINV- VGASnoop- ParErr- Stepping- SERR- FastB2B- DisINTx-
	Status: Cap+ 66MHz- UDF- FastB2B- ParErr- DEVSEL=medium >TAbort- <TAbort- <MAbort- >SERR- <PERR- INTx-
	Latency: 64 (250ns min, 10500ns max), Cache Line Size: 64 bytes
	Interrupt: pin B routed to IRQ 10
	Region 0: Memory at 98400000 (32-bit, non-prefetchable) [size=4K]
	Capabilities: [40] Power Management version 2
		Flags: PMEClk- DSI- D1+ D2+ AuxCurrent=0mA PME(D0+,D1+,D2+,D3hot+,D3cold+)
		Status: D0 PME-Enable- DSel=0 DScale=0 PME+
	Kernel driver in use: ohci_hcd
	Kernel modules: ohci-hcd

00:12.2 USB Controller: NEC Corporation USB 2.0 (rev 04) (prog-if 20)
	Subsystem: Compaq Computer Corporation Device 005a
	Control: I/O- Mem+ BusMaster+ SpecCycle- MemWINV+ VGASnoop- ParErr- Stepping- SERR- FastB2B- DisINTx-
	Status: Cap+ 66MHz- UDF- FastB2B- ParErr- DEVSEL=medium >TAbort- <TAbort- <MAbort- >SERR- <PERR- INTx-
	Latency: 64 (4000ns min, 8500ns max), Cache Line Size: 64 bytes
	Interrupt: pin C routed to IRQ 10
	Region 0: Memory at 98480000 (32-bit, non-prefetchable) [size=256]
	Capabilities: [40] Power Management version 2
		Flags: PMEClk- DSI- D1+ D2+ AuxCurrent=0mA PME(D0+,D1+,D2+,D3hot+,D3cold+)
		Status: D0 PME-Enable- DSel=0 DScale=0 PME-
	Kernel driver in use: ehci_hcd
	Kernel modules: ehci-hcd

00:13.0 Ethernet controller: Broadcom Corporation NetXtreme BCM5705M Gigabit Ethernet (rev 03)
	Subsystem: Compaq Computer Corporation Device 005a
	Control: I/O- Mem+ BusMaster+ SpecCycle- MemWINV- VGASnoop- ParErr- Stepping- SERR- FastB2B- DisINTx-
	Status: Cap+ 66MHz+ UDF- FastB2B+ ParErr- DEVSEL=medium >TAbort- <TAbort- <MAbort- >SERR- <PERR- INTx-
	Latency: 64 (16000ns min), Cache Line Size: 64 bytes
	Interrupt: pin A routed to IRQ 10
	Region 0: Memory at 98000000 (64-bit, non-prefetchable) [size=64K]
	[virtual] Expansion ROM at 30000000 [disabled] [size=64K]
	Capabilities: [48] Power Management version 2
		Flags: PMEClk- DSI- D1- D2- AuxCurrent=0mA PME(D0-,D1-,D2-,D3hot+,D3cold+)
		Status: D0 PME-Enable+ DSel=0 DScale=1 PME-
	Capabilities: [50] Vital Product Data <?>
	Capabilities: [58] Message Signalled Interrupts: Mask- 64bit+ Queue=0/3 Enable-
		Address: efbf2ff7fffffffc  Data: ffff
	Kernel driver in use: tg3
	Kernel modules: tg3

01:05.0 VGA compatible controller: ATI Technologies Inc Radeon IGP 330M/340M/350M
	Subsystem: Compaq Computer Corporation Device 005a
	Control: I/O+ Mem+ BusMaster- SpecCycle- MemWINV- VGASnoop- ParErr- Stepping+ SERR- FastB2B- DisINTx-
	Status: Cap+ 66MHz+ UDF- FastB2B+ ParErr- DEVSEL=medium >TAbort- <TAbort- <MAbort- >SERR- <PERR- INTx-
	Interrupt: pin A routed to IRQ 10
	Region 0: Memory at 94000000 (32-bit, prefetchable) [size=64M]
	Region 1: I/O ports at 2000 [size=256]
	Region 2: Memory at 90000000 (32-bit, non-prefetchable) [size=64K]
	[virtual] Expansion ROM at 90020000 [disabled] [size=128K]
	Capabilities: [58] AGP version 2.0
		Status: RQ=48 Iso- ArqSz=0 Cal=0 SBA+ ITACoh- GART64- HTrans- 64bit- FW- AGP3- Rate=x1,x2,x4
		Command: RQ=16 ArqSz=0 Cal=0 SBA+ AGP+ GART64- 64bit- FW- Rate=x4
	Capabilities: [50] Power Management version 2
		Flags: PMEClk- DSI- D1+ D2+ AuxCurrent=0mA PME(D0-,D1-,D2-,D3hot-,D3cold-)
		Status: D0 PME-Enable- DSel=0 DScale=0 PME-
	Kernel modules: radeonfb

